{
  "schemaVersion": 1,
  "name": "response-language",
  "external": false,
  "description": "Локальный плагин для автоматического выбора языка ответа, если пользователь явно его не указал: язык определяется по доминирующему языку самой задачи, при этом код остается на английском, а комментарии пишутся на выбранном языке ответа.",
  "sync": {
    "enabled": false,
    "script": "sync.sh"
  }
}
