{
  "schemaVersion": 1,
  "name": "xlsx",
  "description": "Навык для работы с Excel (.xlsx) из anthropics/skills.",
  "external": true,
  "source": {
    "type": "git",
    "url": "https://github.com/anthropics/skills.git",
    "ref": "main"
  },
  "sync": {
    "enabled": true,
    "script": "sync.sh",
    "copy": [
      {
        "from": "skills/xlsx",
        "to": "skills/xlsx"
      }
    ]
  }
}
